{
  "ts": 1751450200,
  "signal_tier": "oauth",
  "normalized": {
    "session": { "utilization": 12.0, "resets_at": "2026-02-08T04:59:59+00:00" },
    "weekly": { "utilization": 8.0, "resets_at": "2026-02-12T14:59:59+00:00" },
    "extra_usage": { "is_enabled": true, "used_credits": 12.5 }
  },
  "cost": { "total_cost_usd": 3.10 }
}
