{
  "ts": 1751450000,
  "signal_tier": "statusline",
  "rate_limits": {
    "five_hour": { "used_percentage": 23.5, "resets_at": 1738425600 },
    "seven_day": { "used_percentage": 41.2, "resets_at": 1738857600 }
  },
  "normalized": {
    "session": { "utilization": 23.5, "resets_at": "2025-02-01T16:00:00Z" },
    "weekly": { "utilization": 41.2, "resets_at": "2025-02-06T16:00:00Z" },
    "extra_usage": { "is_enabled": null, "used_credits": null }
  },
  "cost": { "total_cost_usd": 1.42, "total_duration_ms": 45000 },
  "session_id": "sess-abc123",
  "model": "claude-sonnet-5",
  "cwd": "/home/berkay/dev/one-ocean-cms"
}
